{
  "normalized_snapshot_id": "normalized-snapshot-amxl-20260528T150000Z",
  "schema_version": "1.0.0",
  "raw_snapshot_id": "raw-snapshot-amxl-20260528T150000Z",
  "asset": {
    "symbol": "AMXL",
    "market": "BMV",
    "asset_role": "monitoring_target"
  },
  "observed_at": "2026-05-28T15:00:00Z",
  "normalized_at": "2026-05-28T15:05:00Z",
  "observed_values": {
    "last_price": 18.42,
    "currency": "MXN",
    "volume": 1200000
  },
  "provenance": {
    "source_raw_snapshot_id": "raw-snapshot-amxl-20260528T150000Z",
    "transformation_notes": "Canonical symbol and observed values preserved from static raw sample."
  }
}
